source,channel,title,views,likes,comments,published_at,duration,url,video_id
channel,Housecall Pro,How to Get More Reviews Automatically | Housecall Pro Review Management Guide,370,7,1,2026-05-08,PT4M25S,https://youtube.com/watch?v=d4c8AhQtyHA,d4c8AhQtyHA
channel,Housecall Pro,Superpro Podcast #84: A Military Firefighter Growing Business - Bret Martine,107,0,0,2025-11-11,PT35M3S,https://youtube.com/watch?v=FRVeyQcKaEo,FRVeyQcKaEo
channel,Housecall Pro,Superpro Podcast #83: From Military to Millionaire - Robert Bednarz,121,6,0,2025-11-04,PT45M29S,https://youtube.com/watch?v=zVqpWEfpgF0,zVqpWEfpgF0
channel,Housecall Pro,Superpro Podcast #44: Cleaning Up on the Treasure Coast - Chris Cea,195,4,1,2025-01-21,PT30M32S,https://youtube.com/watch?v=VrNRBTN5D4c,VrNRBTN5D4c
channel,Housecall Pro,Superpro Podcast #10: Keys to Hiring and Training - Kyle Newby,755,7,0,2024-06-07,PT40M49S,https://youtube.com/watch?v=KtAOyPuL-Zk,KtAOyPuL-Zk
channel,Housecall Pro,Mergers & Acquisition: Buy Side Advice | Marvin Salcido,83,1,0,2023-08-14,PT13M32S,https://youtube.com/watch?v=k8WlrH2p0Vc,k8WlrH2p0Vc
channel,Jobber,The BEST Advice from Real $1M+ Business Owners,71,1,2,2026-06-30,PT4M46S,https://youtube.com/watch?v=yCfzF9cjry4,yCfzF9cjry4
channel,Jobber,What It Really Takes to Build a $1M Business,249,4,2,2026-06-23,PT17M44S,https://youtube.com/watch?v=B4ccIM0CwE0,B4ccIM0CwE0
channel,Jobber,The New Local SEO: How to Get Found in AI Search,186,10,0,2026-05-21,PT19M42S,https://youtube.com/watch?v=nfne3O9pK8U,nfne3O9pK8U
channel,Jobber,What Skipping Time Tracking Is Really Costing You,684,10,0,2026-01-06,PT27M59S,https://youtube.com/watch?v=RJj3rIjClXw,RJj3rIjClXw
channel,ServiceTitan,Unlock Revenue Opportunities With ServiceTitan Atlas and Marketing Pro | Podcast Ep. 94,99,3,0,2026-06-25,PT25M39S,https://youtube.com/watch?v=6h6hQyaEBNw,6h6hQyaEBNw
channel,ServiceTitan,Release #78  ServiceTitan Release Notes Overview Summer 2026,636,29,4,2026-06-24,PT18M25S,https://youtube.com/watch?v=Krz6VS0Y8-o,Krz6VS0Y8-o
channel,ServiceTitan,Psychological Safety in Leadership: How Trust Transformed an Entire Company | Ep. 92,62,1,0,2026-06-11,PT24M9S,https://youtube.com/watch?v=qvHRdXZQnSw,qvHRdXZQnSw
channel,Workiz,Automatically reconciling credit card payouts with QuickBooks Online,168,1,0,2026-03-20,PT3M28S,https://youtube.com/watch?v=0DCDQbdfWgA,0DCDQbdfWgA
channel,Workiz,How to Get SO Many Customers with AI & CRM: The 2026 Growth Blueprint,99,1,2,2026-03-20,PT52M48S,https://youtube.com/watch?v=FlSouL_lYzY,FlSouL_lYzY
channel,Workiz,Top Ways How to Scale a Home Service Business: From Technician to CEO | Workiz,105,0,0,2026-03-09,PT48M11S,https://youtube.com/watch?v=zHOP6dgjjPM,zHOP6dgjjPM
channel,Workiz,Close bigger jobs: How to master consumer financing & beat price haggling,59,0,0,2026-02-12,PT57M44S,https://youtube.com/watch?v=n_U54uFK8nk,n_U54uFK8nk
channel,Workiz,"AI, FSM, and marketing for replacement sales",148,0,0,2025-12-11,PT1H37S,https://youtube.com/watch?v=-4vzSeazkuc,-4vzSeazkuc
channel,Workiz,Getting your ducks in a row: How to legally protect and grow your home-service business,166,11,0,2025-11-13,PT40M8S,https://youtube.com/watch?v=YjPYQWvEbuM,YjPYQWvEbuM
channel,QuoteIQ,"QuoteIQ Estimating & Invoicing Walkthrough: Instant Payouts, AI Quotes & Customer Self-Booking",280,11,13,2026-06-19,PT8M1S,https://youtube.com/watch?v=Z_X5am48Xfk,Z_X5am48Xfk
channel,QuoteIQ,QuoteIQ Setup Walkthrough 2026: How to Set Up Your Field Service CRM — Full Tutorial for Contractors,168,9,3,2026-06-18,PT7M37S,https://youtube.com/watch?v=rada9h9mDj8,rada9h9mDj8
channel,QuoteIQ,QuoteIQ Cam Walkthrough - CompanyCam Alternative,276,18,4,2026-06-12,PT15M53S,https://youtube.com/watch?v=hFAimxN-jcA,hFAimxN-jcA
channel,QuoteIQ,QuoteIQ Full Demo Walkthrough 2026 | Full Contractor FSM Software Tour,570,18,4,2026-06-05,PT22M52S,https://youtube.com/watch?v=3NUASYoga7s,3NUASYoga7s
channel,QuoteIQ,"New QuoteIQ Estimate Features: Accept, Decline, or Request a Change",236,15,5,2026-06-03,PT4M58S,https://youtube.com/watch?v=RD_w8-wUjCI,RD_w8-wUjCI
channel,QuoteIQ,"QuoteIQ AI AutoReply - The AI That Books Jobs, Answers Customers and Runs Your Office While You Work",535,17,4,2026-05-27,PT21M30S,https://youtube.com/watch?v=-5v_mY9JOCA,-5v_mY9JOCA
inspiration: Electrician U,Electrician U,DC to AC Conversion Explained Simply!,56854,1746,81,2024-12-13,PT12M19S,https://youtube.com/watch?v=z6gJG63Ft7o,z6gJG63Ft7o
inspiration: Electrician U,Electrician U,How to Bend a Perfect Box Offset? Electricians Need to Know How to Bend Conduit.,165281,4232,264,2022-04-11,PT5M25S,https://youtube.com/watch?v=irKqu_PEbhk,irKqu_PEbhk
inspiration: Electrician U,Electrician U,Tips on Turning Side Work into a Business,69901,2461,182,2022-01-12,PT7M48S,https://youtube.com/watch?v=qnP27tV5QQM,qnP27tV5QQM
inspiration: Electrician U,Electrician U,4 Basic Electrical Testers & HOW TO USE THEM,1105144,26314,714,2021-03-15,PT15M24S,https://youtube.com/watch?v=ZfWDESUEfmA,ZfWDESUEfmA
inspiration: Electrician U,Electrician U,360 DEGREE RULE for BENDING CONDUIT - No More Than 360 Degrees of Bends,59104,1381,76,2019-10-30,PT6M56S,https://youtube.com/watch?v=XLjzfJ1tiko,XLjzfJ1tiko
inspiration: Electrician U,Electrician U,UPDATE: NEW ELECTRICIAN U STUDIO (Part 1) and Season 3 Content Coming Soon!,11355,578,77,2019-06-03,PT5M23S,https://youtube.com/watch?v=Gv62fNIJmp4,Gv62fNIJmp4
inspiration: Carl Murawski,Carl Murawski,I Bought the Wrong Work Boots for 20 Years,39749,1041,135,2026-06-19,PT10M22S,https://youtube.com/watch?v=-7V4qX9iPKI,-7V4qX9iPKI
inspiration: Carl Murawski,Carl Murawski,Who makes the best lunch cooler?,12516,377,76,2026-06-01,PT21M17S,https://youtube.com/watch?v=8qmsCX8cBeA,8qmsCX8cBeA
inspiration: Carl Murawski,Carl Murawski,I Opened a 50-Year-Old Electrical Panel. Here's what scared me,4350,197,28,2026-05-27,PT8M46S,https://youtube.com/watch?v=fhxSLyl-_LM,fhxSLyl-_LM
inspiration: Carl Murawski,Carl Murawski,A Love Letter to Workwear - The Litchfield Jacket,4996,274,32,2026-05-16,PT9M56S,https://youtube.com/watch?v=rLZXNX0GX7c,rLZXNX0GX7c
inspiration: Carl Murawski,Carl Murawski,"The best work boots ($600-$1,000)",8330,268,13,2026-05-06,PT3M,https://youtube.com/watch?v=bH1WcwDYYFQ,bH1WcwDYYFQ
inspiration: Carl Murawski,Carl Murawski,The Best Work Boots at Every Price (Don’t Waste Your Money),53059,889,133,2026-05-01,PT13M52S,https://youtube.com/watch?v=8x_U4o24hoc,8x_U4o24hoc
inspiration: Carl Murawski,Carl Murawski,Why Pros Carry Fewer Tools,77610,1126,138,2026-04-26,PT14M45S,https://youtube.com/watch?v=M4gAKQg5cVs,M4gAKQg5cVs
inspiration: Carl Murawski,Carl Murawski,What's in my tool bag?,24264,1126,40,2026-04-25,PT3M,https://youtube.com/watch?v=rSVswuZzIUY,rSVswuZzIUY
inspiration: Carl Murawski,Carl Murawski,Limmer Boots: Why They Cost So Much (And If They're Worth It),70116,2101,176,2026-04-12,PT23M40S,https://youtube.com/watch?v=MkGav0CIVlQ,MkGav0CIVlQ
inspiration: Carl Murawski,Carl Murawski,American vs European Workwear: What Actually Works?,242949,5348,1021,2026-04-05,PT9M51S,https://youtube.com/watch?v=XkhxsPNZ9Jc,XkhxsPNZ9Jc
inspiration: Carl Murawski,Carl Murawski,NEW Carhartt Rugged Flex Jeans: Who They’re Actually For,19776,644,101,2026-03-20,PT9M23S,https://youtube.com/watch?v=fZnJOtwYEyg,fZnJOtwYEyg
search: HVAC tips,How To Home,Genius AC Upgrade That Makes Air Colder And Bills Lower!,1116467,24298,2638,2026-05-16,PT13M8S,https://youtube.com/watch?v=gQjotD-B0OU,gQjotD-B0OU
search: HVAC tips,How To Home,"Make Any AC Blow Colder, Quieter, And Lower Electric Bill!",504588,14774,599,2026-04-18,PT14M14S,https://youtube.com/watch?v=wMHIfUIVuJA,wMHIfUIVuJA
search: HVAC tips,The DIY HVAC Guy,This New HVAC Fitting Might Replace Brazing Forever,269099,7191,1100,2026-04-04,PT12M11S,https://youtube.com/watch?v=xnwsmSacQyY,xnwsmSacQyY
search: HVAC tips,Energy Measure To Save,Air conditioner’s Electricity Bills can be reduced upto 30% #AC #electricbill #BEE #energysaving,258961,13605,825,2026-04-19,PT9M27S,https://youtube.com/watch?v=2ydQNz5O4I4,2ydQNz5O4I4
search: HVAC tips,EMM VLOGS,Severely Clogged AC Coils Deep Cleaning | Amazing Results,71246,1073,131,2026-05-18,PT14M55S,https://youtube.com/watch?v=xkgqO13PSQE,xkgqO13PSQE
search: HVAC tips,Taddy Digest,How to Read HVAC Schematics (Beginner to Pro – Furnace & AC Explained),71303,4600,134,2026-04-17,PT15M35S,https://youtube.com/watch?v=HbMqTEDxPGA,HbMqTEDxPGA
search: HVAC tips,Odia career info,AC ଥଣ୍ଡା କରୁନାହିଁ? 🥶 90% ଲୋକ ଏହି ଭୁଲ୍ କରନ୍ତି | AC Low Cooling Problem Fix Odia,47727,261,30,2026-06-06,PT5M45S,https://youtube.com/watch?v=b7z1MsGHRTg,b7z1MsGHRTg
search: HVAC tips,HVAC School,The Science Behind Torch Tips Every HVAC Tech Must Know,5264,286,29,2026-05-03,PT19M21S,https://youtube.com/watch?v=mQCQuc95AW0,mQCQuc95AW0
search: HVAC tips,Sidney Explains ,Your AC Doesn't Need Freon — It Needs This $5 Fix,4822,226,13,2026-06-09,PT6M32S,https://youtube.com/watch?v=gyjcxOLWRRE,gyjcxOLWRRE
search: HVAC tips,Pioneer HVAC Controls,How to Troubleshoot on a Service Call - HVAC Training (Part 2),4570,199,4,2026-05-08,PT16M11S,https://youtube.com/watch?v=yDwz7jraLQ8,yDwz7jraLQ8
search: plumbing tips,Tips Unknown,Genius Invention by a 60 Year Old Plumber! Free energy source from Plastic fruit crate and PVC pipes,1276669,18984,272,2026-04-04,PT18M1S,https://youtube.com/watch?v=Fd6fEZlQMro,Fd6fEZlQMro
search: plumbing tips,Roger the Pipe Guy,Why Plumbers' Own Drains Never Clog — The $2 Monthly Habit They Don't Advertise,558559,16813,689,2026-06-20,PT18M45S,https://youtube.com/watch?v=YjPAVZAffh0,YjPAVZAffh0
search: plumbing tips,Tips Unknown,The crazy idea of ​​a 60-year-old plumber! Free energy source from old toilet and Cement!,504541,4206,22,2026-04-23,PT17M4S,https://youtube.com/watch?v=KBMsVTBnDOo,KBMsVTBnDOo
search: plumbing tips,Roger the Pipe Guy,"In 45 Years of Plumbing, I've Never Had a Clogged Drain — Here's Exactly What I Do",450455,7716,188,2026-04-30,PT19M5S,https://youtube.com/watch?v=hebGJ43lQ6s,hebGJ43lQ6s
search: plumbing tips,Beamish DIY,Plumber Tricks That Fix Common Problems Fast 🔧💧 #diy #helpful #plumbing #tips,260351,251,2,2026-05-04,PT12M3S,https://youtube.com/watch?v=PtleLZwhZAE,PtleLZwhZAE
search: plumbing tips,Mr Nik,Top 30 Best Plumbing Tips and Tricks You Really Need to Know!,159812,864,7,2026-06-23,PT5M3S,https://youtube.com/watch?v=08YqkuAbeF4,08YqkuAbeF4
search: plumbing tips,Roger the Pipe Guy,SharkBite vs Solder - Which Is ACTUALLY Stronger! (Pressure Test!),145817,3222,346,2026-04-17,PT18M20S,https://youtube.com/watch?v=DAZ4KZ6A5a0,DAZ4KZ6A5a0
search: plumbing tips,Technical sonu Tech,1000LTR Water Tank Installation|How Does Work Water Tank Air Vent|Plumber Sonu,110232,1088,30,2026-04-21,PT16M5S,https://youtube.com/watch?v=0Zly6YK4sz4,0Zly6YK4sz4
search: plumbing tips,All About RV's,These 4 RV Sewer Valve Tips Changed Everything! RV Valve Maintenance Made Easy.,76186,3459,83,2026-05-23,PT11M24S,https://youtube.com/watch?v=jTUTSJd5SE0,jTUTSJd5SE0
search: plumbing tips,Federal Plumbing,Cambiamos el Desagüe del Fregadero por un Coflex ,64514,1265,21,2026-06-22,PT4M15S,https://youtube.com/watch?v=EmDyle_k26Y,EmDyle_k26Y
search: electrician tips,The DIY Guy,5 Electrical Hacks That Save Hundreds (DIY Friendly),682052,16865,1087,2026-04-25,PT17M35S,https://youtube.com/watch?v=vUq1nmhRSYE,vUq1nmhRSYE
search: electrician tips,Electric Online,Electrician Mastery: Learn These 2 Essential Concepts & Master All Electrical Work,161668,5503,205,2026-06-15,PT5M26S,https://youtube.com/watch?v=1jX5OkXJIeM,1jX5OkXJIeM
search: electrician tips,Solar and Electric tips,2 585 watt solar panel se kya kya chala sakte hain || how to install solar system step by step,87902,1639,306,2026-05-20,PT17M24S,https://youtube.com/watch?v=yGorfiPecPc,yGorfiPecPc
search: electrician tips,Electrical Telugu,On Grid Solar Panels కొన్ని నిజాలు || Electrical Telugu,78198,2207,120,2026-05-20,PT19M24S,https://youtube.com/watch?v=cNiMuRyukVI,cNiMuRyukVI
search: electrician tips,Electric Online,Make a Series Test Board with Just One Wire | Check All Faulty Electrical Appliances at Home,57427,1853,186,2026-06-01,PT4M50S,https://youtube.com/watch?v=0OvzpcSVYdI,0OvzpcSVYdI
search: electrician tips, ITI JOBS IG,कितने mm वायर कितना Load झेलता है? | 1mm से 6mm तक पूरा सच ⚡Wire Load Capacity ,45123,737,39,2026-04-12,PT5M35S,https://youtube.com/watch?v=kwQsyM_faAo,kwQsyM_faAo
search: electrician tips,Electric Online,Electrical Board Wiring Explained in 1 Minute | Identify Every Wire Easily | Beginner to Electrician,41202,1559,142,2026-06-22,PT6M3S,https://youtube.com/watch?v=wc4Y-TQyCsQ,wc4Y-TQyCsQ
search: electrician tips,Codezzy 2,10 PRO TIPS For NEW TECHNICIAN SURVIVOR CLASS.. (Bite by Night),36903,1242,137,2026-04-21,PT13M39S,https://youtube.com/watch?v=ZEUsEaeEU_A,ZEUsEaeEU_A
search: electrician tips,Solar and Electric tips,Khurshid fan vs Tamoor Fan | Pakistan best AC DC fan ,32816,1444,452,2026-04-17,PT16M51S,https://youtube.com/watch?v=0_ETMPQCAk0,0_ETMPQCAk0
search: electrician tips,Solar and Electric tips,585 watt solar panel per kya kya Chala sakte hain || 585 2 solar panels installation ,19296,424,152,2026-06-03,PT9M24S,https://youtube.com/watch?v=1Q00xolUxaY,1Q00xolUxaY
search: field service business,Rand Group,Dynamics 365 Field Service Overview,9496,9,0,2026-04-06,PT8M,https://youtube.com/watch?v=ygUKKAv-O5s,ygUKKAv-O5s
search: field service business,Odoo,Revamp Your Business: Odoo HVAC Configuration,1222,13,4,2026-04-08,PT4M33S,https://youtube.com/watch?v=pFSx7w-XmnE,pFSx7w-XmnE
search: field service business,Business Wali Smart Baate,"Full Video | Stop Managing Blindly, Start Tracking Your Field Operations Smartly",2914,14,4,2026-04-20,PT9M29S,https://youtube.com/watch?v=vKrS0uSTrAE,vKrS0uSTrAE
search: field service business,Maximizing Zoho for Your Business,Zoho CRM Deals Module for Field Service Businesses: 12 Years of Real-World Expertise,1654,2,4,2026-05-07,PT16M17S,https://youtube.com/watch?v=f627AvoEIG4,f627AvoEIG4
search: field service business,SAP Help and Learning,AI-Powered Asset and Service Operations with SAP Field Service and Asset Management | Demo,791,9,0,2026-05-20,PT6M35S,https://youtube.com/watch?v=SjxgS1F0yxs,SjxgS1F0yxs
search: field service business,OraclePy,Oracle Field Service (OFSC) Tutorial for Beginners | First Video,612,22,3,2026-04-09,PT12M32S,https://youtube.com/watch?v=cncVp4YzUMw,cncVp4YzUMw
search: field service business,FieldPulse,FieldPulse Mobile App Overview (2026),554,8,0,2026-05-07,PT5M48S,https://youtube.com/watch?v=DqTsAdPAMIc,DqTsAdPAMIc
search: field service business,Be Productive,Connecteam - Best Field Service Management Software for 2026,14390,10,28,2026-04-23,PT6M55S,https://youtube.com/watch?v=ZAZ9gR5ZkqI,ZAZ9gR5ZkqI
search: field service business,Ai Driven Field Service Management | Simpro,Ai Driven Field Service Management Software | Simpro Lightning Demo - Take a Look!,465,1,1,2026-05-18,PT4M50S,https://youtube.com/watch?v=w7TEw1HyPMk,w7TEw1HyPMk
search: field service business,Housecall Pro,How to Run Your Service Business from Your Phone | Housecall Pro Mobile App,399,12,0,2026-06-18,PT7M40S,https://youtube.com/watch?v=mDlspP_16UU,mDlspP_16UU
search: home service business,Sarthak Sachdeva,I Tried Secret Home Services!,1352896,25488,1835,2026-05-23,PT15M43S,https://youtube.com/watch?v=kLiwHHLzg9E,kLiwHHLzg9E
search: home service business,Patrick Dang,How I'd Start a 1-Person Business With Claude AI in 30 Days,424237,17208,382,2026-04-06,PT17M32S,https://youtube.com/watch?v=gRcBu8LyfGo,gRcBu8LyfGo
search: home service business,DIGITAL PATHSHALA,How to Start Small Business at Home | Small Business Ideas at Home,389397,5407,113,2026-04-30,PT9M48S,https://youtube.com/watch?v=Wi-tVEZuAU4,Wi-tVEZuAU4
search: home service business,DIGITAL PATHSHALA,Small Business ideas at Home | Small Business Ideas 2026,320824,3583,101,2026-05-14,PT12M1S,https://youtube.com/watch?v=sYNr7uSEOuQ,sYNr7uSEOuQ
search: home service business,Alex Hormozi,How to Use AI in Your Business in 2026,231094,6261,227,2026-04-21,PT15M54S,https://youtube.com/watch?v=fr78adfAnuA,fr78adfAnuA
search: home service business,Austin Zaback,"10 ""Boring"" Service Businesses Making People Rich (Low Competition!)",213206,4036,144,2026-05-14,PT16M55S,https://youtube.com/watch?v=zZohb9W-TiA,zZohb9W-TiA
search: home service business,Baaten Bazar Ki (BBK),"Instant Help Services Boom, But Why Are Companies Still Losing Money? | By Ankit Sir",173778,5149,212,2026-05-11,PT11M4S,https://youtube.com/watch?v=U5l1yU-vP8w,U5l1yU-vP8w
search: home service business,Tim Richard,9 Low-Competition Service Businesses No One Is Talking About,168730,4174,124,2026-04-07,PT15M20S,https://youtube.com/watch?v=breAeo8UKpU,breAeo8UKpU
search: home service business,Naveen Sir,Amazon Work from Home For July 2026 | 12th Pass Freshers Job | Amazon Remote Job Vacancy 2026,61678,1276,63,2026-06-25,PT8M43S,https://youtube.com/watch?v=WMzmCLNyUXQ,WMzmCLNyUXQ
search: home service business,Phlash Consulting,Your Website Won't Matter in 3 Years (Here's What to Build Instead),48768,2251,397,2026-06-23,PT15M36S,https://youtube.com/watch?v=xAIeA3ewRbo,xAIeA3ewRbo
