source,channel,title,views,likes,comments,published_at,duration,url,video_id
channel,Housecall Pro,Why Your Website Isn’t Getting Jobs (And How to Fix It Fast),204,4,1,2026-06-01,PT6M35S,https://youtube.com/watch?v=69N5B8pjkN0,69N5B8pjkN0
channel,Housecall Pro,How to Schedule Jobs & Manage Your Calendar | Housecall Pro Tutorial,586,15,0,2026-05-19,PT8M41S,https://youtube.com/watch?v=0e_1rt27inY,0e_1rt27inY
channel,Housecall Pro,Pro Power Hour: Estimates Deep Dive,427,4,1,2026-05-12,PT43M59S,https://youtube.com/watch?v=fQRoQzOG1RM,fQRoQzOG1RM
channel,Housecall Pro,AI Accelerator Week | Reporting and Advanced Workflows,113,1,0,2026-05-11,PT1H7M45S,https://youtube.com/watch?v=_D0v4byqQlQ,_D0v4byqQlQ
channel,Housecall Pro,AI Accelerator Week | Get More Jobs,102,1,0,2026-05-11,PT1H56S,https://youtube.com/watch?v=gw_peRWURAg,gw_peRWURAg
channel,Housecall Pro,How to Get More Reviews Automatically | Housecall Pro Review Management Guide,247,7,1,2026-05-08,PT4M25S,https://youtube.com/watch?v=d4c8AhQtyHA,d4c8AhQtyHA
channel,Housecall Pro,Pro Power Hour: Dispatching and April Platform Updates,274,4,0,2026-05-05,PT31M23S,https://youtube.com/watch?v=yi6PI8shnx4,yi6PI8shnx4
channel,Housecall Pro,Pro Power Hour: Job Inbox,200,1,0,2026-04-30,PT51M46S,https://youtube.com/watch?v=iRYMFAtnBgU,iRYMFAtnBgU
channel,Housecall Pro,Pro Power Hour: Jobs and Job Fields,402,3,0,2026-03-31,PT40M12S,https://youtube.com/watch?v=Og4AmFZrBZQ,Og4AmFZrBZQ
channel,Workiz,Automatically reconciling credit card payouts with QuickBooks Online,150,1,0,2026-03-20,PT3M28S,https://youtube.com/watch?v=0DCDQbdfWgA,0DCDQbdfWgA
channel,Workiz,How to Get SO Many Customers with AI & CRM: The 2026 Growth Blueprint,90,1,2,2026-03-20,PT52M48S,https://youtube.com/watch?v=FlSouL_lYzY,FlSouL_lYzY
channel,Workiz,Top Ways How to Scale a Home Service Business: From Technician to CEO | Workiz,99,0,0,2026-03-09,PT48M11S,https://youtube.com/watch?v=zHOP6dgjjPM,zHOP6dgjjPM
channel,Workiz,Close bigger jobs: How to master consumer financing & beat price haggling,59,0,0,2026-02-12,PT57M44S,https://youtube.com/watch?v=n_U54uFK8nk,n_U54uFK8nk
channel,Workiz,"AI, FSM, and marketing for replacement sales",146,0,0,2025-12-11,PT1H37S,https://youtube.com/watch?v=-4vzSeazkuc,-4vzSeazkuc
channel,Workiz,Getting your ducks in a row: How to legally protect and grow your home-service business,166,11,0,2025-11-13,PT40M8S,https://youtube.com/watch?v=YjPYQWvEbuM,YjPYQWvEbuM
channel,Electrician U,Ghost Voltage and How Electricians Test It?,2900,337,27,2026-06-08,PT10M42S,https://youtube.com/watch?v=xPHke1LVnF0,xPHke1LVnF0
channel,Electrician U,Which Multimeter Should an Apprentice Electrician Buy First?,20972,805,50,2026-04-27,PT18M24S,https://youtube.com/watch?v=aANfZoFYcHg,aANfZoFYcHg
channel,Electrician U,MC Cable vs AC Cable: Are They the Same Thing?,36717,1283,75,2026-03-30,PT26M45S,https://youtube.com/watch?v=1oGX0ihOUl4,1oGX0ihOUl4
channel,Electrician U,Voltage vs Amperage vs Wattage vs Ohmage?,39038,1597,113,2026-01-26,PT17M31S,https://youtube.com/watch?v=bo8B3S-hfN0,bo8B3S-hfN0
channel,Electrician U,Splices And Terminations That Fail Code In The 2026 NEC,75083,2587,263,2026-01-19,PT22M18S,https://youtube.com/watch?v=PJWSare36bY,PJWSare36bY
channel,Electrician U,Upgrading Your Electrical Panel to 400 Amps | Cost Breakdown,92707,2187,399,2026-01-06,PT20M43S,https://youtube.com/watch?v=Q7_3LMNhkZA,Q7_3LMNhkZA
channel,Electrician U,Does More Current Mean Faster Electrons or More Electrons?,27085,1035,154,2025-12-15,PT9M28S,https://youtube.com/watch?v=Tz2ZzctgEAw,Tz2ZzctgEAw
channel,Electrician U,WAGO Connectors are a GAME CHANGER When Wires are Too Short,59978,1715,176,2025-12-08,PT7M10S,https://youtube.com/watch?v=WAbo0-g3Fog,WAbo0-g3Fog
channel,Electrician U,How Circuit Breakers REALLY Work In Your Home Panel,18473,828,52,2025-12-01,PT11M24S,https://youtube.com/watch?v=hBDPRx9_LKM,hBDPRx9_LKM
channel,Electrician U,What I Wish My Son Knew About Mastery,12258,483,53,2025-11-24,PT11M8S,https://youtube.com/watch?v=4M0KXs574_c,4M0KXs574_c
channel,Carl Murawski,Most Jobsite Coolers Are a Waste of Money,6907,269,64,2026-06-01,PT21M17S,https://youtube.com/watch?v=8qmsCX8cBeA,8qmsCX8cBeA
channel,Carl Murawski,I Opened a 50-Year-Old Electrical Panel. Here's what scared me,3734,179,27,2026-05-27,PT8M46S,https://youtube.com/watch?v=fhxSLyl-_LM,fhxSLyl-_LM
channel,Carl Murawski,A Love Letter to Workwear - The Litchfield Jacket,4450,265,30,2026-05-16,PT9M56S,https://youtube.com/watch?v=rLZXNX0GX7c,rLZXNX0GX7c
channel,Carl Murawski,"The best work boots ($600-$1,000)",7876,257,13,2026-05-06,PT3M,https://youtube.com/watch?v=bH1WcwDYYFQ,bH1WcwDYYFQ
channel,Carl Murawski,The Best Work Boots at Every Price (Don’t Waste Your Money),44985,768,121,2026-05-01,PT13M52S,https://youtube.com/watch?v=8x_U4o24hoc,8x_U4o24hoc
channel,Carl Murawski,Why Pros Carry Fewer Tools,69369,982,127,2026-04-26,PT14M45S,https://youtube.com/watch?v=M4gAKQg5cVs,M4gAKQg5cVs
channel,Carl Murawski,What's in my tool bag?,24180,1123,40,2026-04-25,PT3M,https://youtube.com/watch?v=rSVswuZzIUY,rSVswuZzIUY
channel,Carl Murawski,Limmer: Are These the Best Hiking Boots Ever Made?,66004,2026,174,2026-04-12,PT23M40S,https://youtube.com/watch?v=MkGav0CIVlQ,MkGav0CIVlQ
channel,Carl Murawski,American vs European Workwear: What Actually Works?,235158,5254,1009,2026-04-05,PT9M51S,https://youtube.com/watch?v=XkhxsPNZ9Jc,XkhxsPNZ9Jc
channel,Carl Murawski,NEW Carhartt Rugged Flex Jeans: Who They’re Actually For,19320,640,100,2026-03-20,PT9M23S,https://youtube.com/watch?v=fZnJOtwYEyg,fZnJOtwYEyg
channel,Carl Murawski,The field vs the office,4010,214,24,2026-03-01,PT13M10S,https://youtube.com/watch?v=abBkvsk9ivE,abBkvsk9ivE
search: HVAC tips,Dr. Nick Survival ,Cool ANY Room 15° for Free. No AC. No Fan. No Electricity. The 3-Minute Setup.,905808,32013,773,2026-03-14,PT12M59S,https://youtube.com/watch?v=siBBCap_Z-s,siBBCap_Z-s
search: HVAC tips,How To Home,Genius AC Upgrade That Makes Air Colder And Bills Lower!,628923,15859,1455,2026-05-16,PT13M8S,https://youtube.com/watch?v=gQjotD-B0OU,gQjotD-B0OU
search: HVAC tips,How To Home,These 3 Simple AC Tricks Save Hundreds in Repair Bills!,304503,9070,408,2026-03-28,PT14M23S,https://youtube.com/watch?v=psieFs6qG3I,psieFs6qG3I
search: HVAC tips,The DIY HVAC Guy,This New HVAC Fitting Might Replace Brazing Forever,246885,6779,1041,2026-04-04,PT12M11S,https://youtube.com/watch?v=xnwsmSacQyY,xnwsmSacQyY
search: HVAC tips,Sidney Explains ,Every Thermostat Has a Hidden Contractor Mode (Cuts Your Bill 30%),75831,2860,97,2026-05-25,PT7M22S,https://youtube.com/watch?v=-pFYKIRS4m0,-pFYKIRS4m0
search: HVAC tips,EMM VLOGS,Severely Clogged AC Coils Deep Cleaning | Amazing Results,60340,935,121,2026-05-18,PT14M55S,https://youtube.com/watch?v=xkgqO13PSQE,xkgqO13PSQE
search: HVAC tips,Taddy Digest,How to Read HVAC Schematics (Beginner to Pro – Furnace & AC Explained),53663,3676,106,2026-04-17,PT15M35S,https://youtube.com/watch?v=HbMqTEDxPGA,HbMqTEDxPGA
search: HVAC tips,Shifa air care,Panasonic NanoeX Split AC 1.5 Ton Installation Full Review | Air Conditioner | Panasonic |Split ,47500,398,76,2026-04-03,PT14M56S,https://youtube.com/watch?v=VIGElFQNODQ,VIGElFQNODQ
search: HVAC tips,Odia career info,AC ଥଣ୍ଡା କରୁନାହିଁ? 🥶 90% ଲୋକ ଏହି ଭୁଲ୍ କରନ୍ତି | AC Low Cooling Problem Fix Odia,12661,87,13,2026-06-06,PT5M45S,https://youtube.com/watch?v=b7z1MsGHRTg,b7z1MsGHRTg
search: HVAC tips,HVAC Dean ,Ranking HVAC Jobs From Hardest to Easiest,6506,383,107,2026-04-06,PT8M12S,https://youtube.com/watch?v=ahpY4KdkyLo,ahpY4KdkyLo
search: plumbing tips,Tips Unknown,Genius Invention by a 60-Year-Old Plumber! 7 Free Recycling Ideas from Plastic Mesh & Old PVC Pipes,3627739,132610,1981,2026-03-21,PT18M2S,https://youtube.com/watch?v=-QZqMT6W9ZQ,-QZqMT6W9ZQ
search: plumbing tips,Tips Unknown,The crazy idea of ​​a 60-year-old plumber! Free energy source from old toilet and Cement!,450950,4047,22,2026-04-23,PT17M4S,https://youtube.com/watch?v=KBMsVTBnDOo,KBMsVTBnDOo
search: plumbing tips,Beamish DIY,Plumber Tricks That Fix Common Problems Fast 🔧💧 #diy #helpful #plumbing #tips,200186,194,2,2026-05-04,PT12M3S,https://youtube.com/watch?v=PtleLZwhZAE,PtleLZwhZAE
search: plumbing tips,Holic Brain,99% of Homeowners Would Call a Plumber If They Didn't Know This! Easy DIY Toilet Unclogging Tips,111972,133,15,2026-05-31,PT10M6S,https://youtube.com/watch?v=KVyWPqfdiKo,KVyWPqfdiKo
search: plumbing tips,Fix This House,Why Are These Plumbing Tools Even Legal?!,4787,358,26,2026-03-29,PT11M29S,https://youtube.com/watch?v=bJLIEBodJAM,bJLIEBodJAM
search: plumbing tips,Electrical wiring plumbing tips,1 HP water pump fitting | water pump installation | electrical wiring and plumbing tips ,4039,15,3,2026-05-23,PT9M47S,https://youtube.com/watch?v=f2C5cP8DLGs,f2C5cP8DLGs
search: plumbing tips,MahiTech videos,വെള്ളത്തിന്റെ pipe പൊട്ടിയാൽ Plumbing അറിയാത്തവർക്കും ഒട്ടിക്കാം.😍 Plumbing Tips for Beginners💥,3396,87,7,2026-05-10,PT4M54S,https://youtube.com/watch?v=nh2CAttqx3g,nh2CAttqx3g
search: plumbing tips,Holic Brain,I wish I knew this before I was 50! Smart Plumbing tip that every plumber wants to know,3239,23,44,2026-05-09,PT8M1S,https://youtube.com/watch?v=cdvF0xdzjzc,cdvF0xdzjzc
search: plumbing tips,Beamish DIY,Smart Tricks Every Plumber & Carpenter Should See ⚒️ #diy #easy #plumbing #tips,3000,8,1,2026-05-11,PT12M2S,https://youtube.com/watch?v=ZALOIqmAsoo,ZALOIqmAsoo
search: plumbing tips,DIY Tips 24h,Amazing DIY Tip | Simple PPR & PVC Pipe Connection Method Few People Know | TIPS 24h !,3335,66,16,2026-06-05,PT8M19S,https://youtube.com/watch?v=dO1QUuIM1Uc,dO1QUuIM1Uc
search: electrician tips,The DIY Guy,5 Electrical Hacks That Save Hundreds (DIY Friendly),575096,15099,982,2026-04-25,PT17M35S,https://youtube.com/watch?v=vUq1nmhRSYE,vUq1nmhRSYE
search: electrician tips,Solar and Electric tips,DC wiring karne ka tarika || 340 watt solar panel per Kia Kia Chala sakte hain ,218540,3298,374,2026-03-11,PT19M45S,https://youtube.com/watch?v=yC0hxvHVP24,yC0hxvHVP24
search: electrician tips,"Venki Technology • 100k views • 1 hour ago



...",How to use Induction Cooktop 🔥 ఇండక్షన్ స్టవ్ ఎలా వాడాలి? Beginners Guide 🔥 ఇలా వాడితే కరెంట్ సేవ్,156354,2058,76,2026-03-18,PT5M16S,https://youtube.com/watch?v=Z9ysuxpDTxM,Z9ysuxpDTxM
search: electrician tips,ElectroTest,Electrician fixed burned-out box and tested wire heating,78627,1466,241,2026-03-18,PT16M56S,https://youtube.com/watch?v=08RnnEFtPrk,08RnnEFtPrk
search: electrician tips,Solar and Electric tips,2 585 watt solar panel se kya kya chala sakte hain || how to install solar system step by step,56829,1181,251,2026-05-20,PT17M24S,https://youtube.com/watch?v=yGorfiPecPc,yGorfiPecPc
search: electrician tips,Electrical Telugu,On Grid Solar కొన్ని నిజాలు || Solar Panels || Electrical Telugu,56644,1728,107,2026-05-20,PT19M24S,https://youtube.com/watch?v=cNiMuRyukVI,cNiMuRyukVI
search: electrician tips,BOB ,വീട്ടിലെ ELCB ട്രിപ്പാകുന്നുണ്ടോ? മഴക്കാലത്ത് ഇതറിഞ്ഞില്ലെങ്കിൽ അപകടം! | Electrical Safety Tips,53099,463,61,2026-05-17,PT8M1S,https://youtube.com/watch?v=wEFYdI4GPU0,wEFYdI4GPU0
search: electrician tips, ITI JOBS IG,कितने mm वायर कितना Load झेलता है? | 1mm से 6mm तक पूरा सच ⚡Wire Load Capacity ,43314,722,36,2026-04-12,PT5M35S,https://youtube.com/watch?v=kwQsyM_faAo,kwQsyM_faAo
search: electrician tips,Codezzy 2,10 PRO TIPS For NEW TECHNICIAN SURVIVOR CLASS.. (Bite by Night),36849,1248,138,2026-04-21,PT13M39S,https://youtube.com/watch?v=ZEUsEaeEU_A,ZEUsEaeEU_A
search: electrician tips,Circuit Tamil,Single Phase Sub Meter Wiring Tamil | EB Bill Save Tips ⚡,32221,521,50,2026-03-20,PT14M32S,https://youtube.com/watch?v=Pu6iJ8k-fSs,Pu6iJ8k-fSs
search: field service business,Oil Brick Road,Why Oilfield Trucking Trumps every other business,2293,74,14,2026-05-09,PT19M55S,https://youtube.com/watch?v=PFD5U47gJbQ,PFD5U47gJbQ
search: field service business,Rand Group,Dynamics 365 Field Service Overview,9443,9,0,2026-04-06,PT8M,https://youtube.com/watch?v=ygUKKAv-O5s,ygUKKAv-O5s
search: field service business,Microsoft Dynamics 365 Community,"Dynamics 365 Field Service, Human Resources, & Project Operations | 2026 Release Wave 1",1319,12,0,2026-03-18,PT4M8S,https://youtube.com/watch?v=-djl4qlm2D0,-djl4qlm2D0
search: field service business,Odoo,Revamp Your Business: Odoo HVAC Configuration,1161,13,4,2026-04-08,PT4M33S,https://youtube.com/watch?v=pFSx7w-XmnE,pFSx7w-XmnE
search: field service business,Business Wali Smart Baate,"Full Video | Stop Managing Blindly, Start Tracking Your Field Operations Smartly",2910,14,4,2026-04-20,PT9M29S,https://youtube.com/watch?v=vKrS0uSTrAE,vKrS0uSTrAE
search: field service business,Maximizing Zoho for Your Business,Zoho CRM Deals Module for Field Service Businesses: 12 Years of Real-World Expertise,1649,2,4,2026-05-07,PT16M17S,https://youtube.com/watch?v=f627AvoEIG4,f627AvoEIG4
search: field service business,Business Solution,Contractor Plus Review & Demo: Best Field Service Software for Contractors?,932,4,15,2026-04-02,PT12M35S,https://youtube.com/watch?v=qIU6Hxkw5Is,qIU6Hxkw5Is
search: field service business,Be Productive,Connecteam - Best Field Service Management Software for 2026,14384,10,28,2026-04-23,PT6M55S,https://youtube.com/watch?v=ZAZ9gR5ZkqI,ZAZ9gR5ZkqI
search: field service business,SAP Help and Learning,AI-Powered Asset and Service Operations with SAP Field Service and Asset Management | Demo,507,6,0,2026-05-20,PT6M35S,https://youtube.com/watch?v=SjxgS1F0yxs,SjxgS1F0yxs
search: field service business,OraclePy,Oracle Field Service (OFSC) Tutorial for Beginners | First Video,463,19,1,2026-04-09,PT12M32S,https://youtube.com/watch?v=cncVp4YzUMw,cncVp4YzUMw
search: home service business,David Heacock,You Don't Need to Start a Business. Just Buy One of These.,1273412,18532,507,2026-03-13,PT15M2S,https://youtube.com/watch?v=R61Y0J3HTCY,R61Y0J3HTCY
search: home service business,Infinity info ,🔴Blinkit - Work from Home Job 2026 | Customer Care Executive | Remote Job 🔥,521784,9899,447,2026-03-21,PT6M6S,https://youtube.com/watch?v=uVeNJCdaVC0,uVeNJCdaVC0
search: home service business,Patrick Dang,How I'd Start a 1-Person Business With Claude AI in 30 Days,408788,16851,371,2026-04-06,PT17M32S,https://youtube.com/watch?v=gRcBu8LyfGo,gRcBu8LyfGo
search: home service business,DIGITAL PATHSHALA,How to Start Small Business at Home | Small Business Ideas at Home,340412,4905,106,2026-04-30,PT9M48S,https://youtube.com/watch?v=Wi-tVEZuAU4,Wi-tVEZuAU4
search: home service business,Alex Hormozi,How to Use AI in Your Business in 2026,212770,5917,219,2026-04-21,PT15M54S,https://youtube.com/watch?v=fr78adfAnuA,fr78adfAnuA
search: home service business,Tim Richard,9 Low-Competition Service Businesses No One Is Talking About,162076,4030,122,2026-04-07,PT15M20S,https://youtube.com/watch?v=breAeo8UKpU,breAeo8UKpU
search: home service business,Austin Zaback,"10 ""Boring"" Service Businesses Making People Rich (Low Competition!)",155510,3077,121,2026-05-14,PT16M55S,https://youtube.com/watch?v=zZohb9W-TiA,zZohb9W-TiA
search: home service business,DIGITAL PATHSHALA,Small Business ideas at Home | Small Business Ideas 2026,153277,1816,59,2026-05-14,PT12M1S,https://youtube.com/watch?v=sYNr7uSEOuQ,sYNr7uSEOuQ
search: home service business,MoreMozi,How to Get More Leads in a Local Service Business,35269,742,19,2026-03-21,PT7M10S,https://youtube.com/watch?v=sw1yJanAA_U,sw1yJanAA_U
search: home service business,Johnny & Sergio,The Simplest Service Business You Can Run From Your Laptop,32373,848,71,2026-03-16,PT13M7S,https://youtube.com/watch?v=Q27nawB-BO0,Q27nawB-BO0
