source,channel,title,views,likes,comments,published_at,duration,url,video_id
channel,Housecall Pro,From Posts to Profits: Using Social Media to Grow Your Business,51,0,0,2026-06-12,PT39M19S,https://youtube.com/watch?v=EorK5ZMy3m8,EorK5ZMy3m8
channel,Housecall Pro,The Next Generation of the Trades: 40 Under 40 and Scholarship Reveal,24,1,1,2026-06-12,PT10M,https://youtube.com/watch?v=j-CtUOSIWJM,j-CtUOSIWJM
channel,Housecall Pro,How to Organize Customer Records & History | Housecall Pro Customer Profiles,193,12,0,2026-06-11,PT6M22S,https://youtube.com/watch?v=D2C60RxjQW0,D2C60RxjQW0
channel,Housecall Pro,Why Your Website Isn’t Getting Jobs (And How to Fix It Fast),265,4,1,2026-06-01,PT6M35S,https://youtube.com/watch?v=69N5B8pjkN0,69N5B8pjkN0
channel,Housecall Pro,How to Schedule Jobs & Manage Your Calendar | Housecall Pro Tutorial,832,19,1,2026-05-19,PT8M41S,https://youtube.com/watch?v=0e_1rt27inY,0e_1rt27inY
channel,Housecall Pro,Pro Power Hour: Estimates Deep Dive,472,4,1,2026-05-12,PT43M59S,https://youtube.com/watch?v=fQRoQzOG1RM,fQRoQzOG1RM
channel,Housecall Pro,AI Accelerator Week | Reporting and Advanced Workflows,116,1,0,2026-05-11,PT1H7M45S,https://youtube.com/watch?v=_D0v4byqQlQ,_D0v4byqQlQ
channel,Housecall Pro,AI Accelerator Week | Get More Jobs,103,1,0,2026-05-11,PT1H56S,https://youtube.com/watch?v=gw_peRWURAg,gw_peRWURAg
channel,Housecall Pro,How to Get More Reviews Automatically | Housecall Pro Review Management Guide,334,7,1,2026-05-08,PT4M25S,https://youtube.com/watch?v=d4c8AhQtyHA,d4c8AhQtyHA
channel,Housecall Pro,Pro Power Hour: Dispatching and April Platform Updates,289,4,0,2026-05-05,PT31M23S,https://youtube.com/watch?v=yi6PI8shnx4,yi6PI8shnx4
channel,Housecall Pro,Pro Power Hour: Job Inbox,212,1,0,2026-04-30,PT51M46S,https://youtube.com/watch?v=iRYMFAtnBgU,iRYMFAtnBgU
channel,Housecall Pro,Pro Power Hour: Jobs and Job Fields,413,3,0,2026-03-31,PT40M12S,https://youtube.com/watch?v=Og4AmFZrBZQ,Og4AmFZrBZQ
channel,Jobber,What It Really Takes to Build a $1M Business,37,1,2,2026-06-23,PT17M44S,https://youtube.com/watch?v=B4ccIM0CwE0,B4ccIM0CwE0
channel,Jobber,The New Local SEO: How to Get Found in AI Search,183,10,0,2026-05-21,PT19M42S,https://youtube.com/watch?v=nfne3O9pK8U,nfne3O9pK8U
channel,Jobber,What Skipping Time Tracking Is Really Costing You,682,10,0,2026-01-06,PT27M59S,https://youtube.com/watch?v=RJj3rIjClXw,RJj3rIjClXw
channel,Workiz,Franchise Mastery: Insider Insights & Strategies for Success #franchise – Episode 4,54,1,0,2024-06-24,PT40M,https://youtube.com/watch?v=rUwT5HKSs-4,rUwT5HKSs-4
channel,Workiz,How to create a memorable junk removal brand,152,3,0,2023-03-05,PT1H1M12S,https://youtube.com/watch?v=f-8SjI5fVBA,f-8SjI5fVBA
channel,Workiz,Why Women in Trades Matter,107,1,0,2022-01-17,PT4M5S,https://youtube.com/watch?v=YHz1B9uLWLU,YHz1B9uLWLU
channel,Electrician U,Ghost Voltage and How Electricians Test It?,29428,1464,129,2026-06-08,PT10M42S,https://youtube.com/watch?v=xPHke1LVnF0,xPHke1LVnF0
channel,Electrician U,Which Multimeter Should an Apprentice Electrician Buy First?,25942,933,57,2026-04-27,PT18M24S,https://youtube.com/watch?v=aANfZoFYcHg,aANfZoFYcHg
channel,Electrician U,MC Cable vs AC Cable: Are They the Same Thing?,42477,1401,79,2026-03-30,PT26M45S,https://youtube.com/watch?v=1oGX0ihOUl4,1oGX0ihOUl4
channel,Electrician U,Voltage vs Amperage vs Wattage vs Ohmage?,40079,1632,114,2026-01-26,PT17M31S,https://youtube.com/watch?v=bo8B3S-hfN0,bo8B3S-hfN0
channel,Electrician U,Splices And Terminations That Fail Code In The 2026 NEC,77193,2647,266,2026-01-19,PT22M18S,https://youtube.com/watch?v=PJWSare36bY,PJWSare36bY
channel,Electrician U,Upgrading Your Electrical Panel to 400 Amps | Cost Breakdown,94169,2217,402,2026-01-06,PT20M43S,https://youtube.com/watch?v=Q7_3LMNhkZA,Q7_3LMNhkZA
channel,Electrician U,Does More Current Mean Faster Electrons or More Electrons?,27397,1040,155,2025-12-15,PT9M28S,https://youtube.com/watch?v=Tz2ZzctgEAw,Tz2ZzctgEAw
channel,Electrician U,WAGO Connectors are a GAME CHANGER When Wires are Too Short,62976,1762,182,2025-12-08,PT7M10S,https://youtube.com/watch?v=WAbo0-g3Fog,WAbo0-g3Fog
channel,Electrician U,How Circuit Breakers REALLY Work In Your Home Panel,18986,839,52,2025-12-01,PT11M24S,https://youtube.com/watch?v=hBDPRx9_LKM,hBDPRx9_LKM
channel,Electrician U,What I Wish My Son Knew About Mastery,12694,496,53,2025-11-24,PT11M8S,https://youtube.com/watch?v=4M0KXs574_c,4M0KXs574_c
channel,Carl Murawski,I Bought the Wrong Work Boots for 20 Years,25657,866,117,2026-06-19,PT10M22S,https://youtube.com/watch?v=-7V4qX9iPKI,-7V4qX9iPKI
channel,Carl Murawski,Most Jobsite Coolers Are a Waste of Money,12036,359,74,2026-06-01,PT21M17S,https://youtube.com/watch?v=8qmsCX8cBeA,8qmsCX8cBeA
channel,Carl Murawski,I Opened a 50-Year-Old Electrical Panel. Here's what scared me,4282,195,28,2026-05-27,PT8M46S,https://youtube.com/watch?v=fhxSLyl-_LM,fhxSLyl-_LM
channel,Carl Murawski,A Love Letter to Workwear - The Litchfield Jacket,4787,269,30,2026-05-16,PT9M56S,https://youtube.com/watch?v=rLZXNX0GX7c,rLZXNX0GX7c
channel,Carl Murawski,"The best work boots ($600-$1,000)",8098,261,13,2026-05-06,PT3M,https://youtube.com/watch?v=bH1WcwDYYFQ,bH1WcwDYYFQ
channel,Carl Murawski,The Best Work Boots at Every Price (Don’t Waste Your Money),49963,833,131,2026-05-01,PT13M52S,https://youtube.com/watch?v=8x_U4o24hoc,8x_U4o24hoc
channel,Carl Murawski,Why Pros Carry Fewer Tools,74386,1084,131,2026-04-26,PT14M45S,https://youtube.com/watch?v=M4gAKQg5cVs,M4gAKQg5cVs
channel,Carl Murawski,What's in my tool bag?,24241,1125,40,2026-04-25,PT3M,https://youtube.com/watch?v=rSVswuZzIUY,rSVswuZzIUY
channel,Carl Murawski,Limmer: Are These the Best Hiking Boots Ever Made?,69006,2080,174,2026-04-12,PT23M40S,https://youtube.com/watch?v=MkGav0CIVlQ,MkGav0CIVlQ
channel,Carl Murawski,American vs European Workwear: What Actually Works?,241234,5325,1020,2026-04-05,PT9M51S,https://youtube.com/watch?v=XkhxsPNZ9Jc,XkhxsPNZ9Jc
channel,Carl Murawski,The field vs the office,4129,222,25,2026-03-01,PT13M10S,https://youtube.com/watch?v=abBkvsk9ivE,abBkvsk9ivE
search: HVAC tips,How To Home,Genius AC Upgrade That Makes Air Colder And Bills Lower!,957856,21829,2280,2026-05-16,PT13M8S,https://youtube.com/watch?v=gQjotD-B0OU,gQjotD-B0OU
search: HVAC tips,How To Home,These 3 Simple AC Tricks Save Hundreds in Repair Bills!,337770,9751,435,2026-03-28,PT14M23S,https://youtube.com/watch?v=psieFs6qG3I,psieFs6qG3I
search: HVAC tips,The DIY HVAC Guy,This New HVAC Fitting Might Replace Brazing Forever,259957,7036,1086,2026-04-04,PT12M11S,https://youtube.com/watch?v=xnwsmSacQyY,xnwsmSacQyY
search: HVAC tips,Energy Measure To Save,Air conditioner’s Electricity Bills can be reduced upto 30% #AC #electricbill #BEE #energysaving,258492,13606,825,2026-04-19,PT9M27S,https://youtube.com/watch?v=2ydQNz5O4I4,2ydQNz5O4I4
search: HVAC tips,EMM VLOGS,Severely Clogged AC Coils Deep Cleaning | Amazing Results,67433,1034,124,2026-05-18,PT14M55S,https://youtube.com/watch?v=xkgqO13PSQE,xkgqO13PSQE
search: HVAC tips,Taddy Digest,How to Read HVAC Schematics (Beginner to Pro – Furnace & AC Explained),65799,4319,123,2026-04-17,PT15M35S,https://youtube.com/watch?v=HbMqTEDxPGA,HbMqTEDxPGA
search: HVAC tips,Shifa air care,Panasonic NanoeX Split AC 1.5 Ton Installation Full Review | Air Conditioner | Panasonic |Split ,49592,410,86,2026-04-03,PT14M56S,https://youtube.com/watch?v=VIGElFQNODQ,VIGElFQNODQ
search: HVAC tips,Odia career info,AC ଥଣ୍ଡା କରୁନାହିଁ? 🥶 90% ଲୋକ ଏହି ଭୁଲ୍ କରନ୍ତି | AC Low Cooling Problem Fix Odia,46341,249,29,2026-06-06,PT5M45S,https://youtube.com/watch?v=b7z1MsGHRTg,b7z1MsGHRTg
search: HVAC tips,HVAC Dean ,Ranking HVAC Jobs From Hardest to Easiest,6637,392,107,2026-04-06,PT8M12S,https://youtube.com/watch?v=ahpY4KdkyLo,ahpY4KdkyLo
search: HVAC tips,HVAC School,The Science Behind Torch Tips Every HVAC Tech Must Know,5163,283,29,2026-05-03,PT19M21S,https://youtube.com/watch?v=mQCQuc95AW0,mQCQuc95AW0
search: plumbing tips,Tips Unknown,Genius Invention by a 60 Year Old Plumber! Free energy source from Plastic fruit crate and PVC pipes,1236569,18733,247,2026-04-04,PT18M1S,https://youtube.com/watch?v=Fd6fEZlQMro,Fd6fEZlQMro
search: plumbing tips,Tips Unknown,The crazy idea of ​​a 60-year-old plumber! Free energy source from old toilet and Cement!,485409,4152,24,2026-04-23,PT17M4S,https://youtube.com/watch?v=KBMsVTBnDOo,KBMsVTBnDOo
search: plumbing tips,Roger the Pipe Guy,"In 45 Years of Plumbing, I've Never Had a Clogged Drain — Here's Exactly What I Do",449281,7694,188,2026-04-30,PT19M5S,https://youtube.com/watch?v=hebGJ43lQ6s,hebGJ43lQ6s
search: plumbing tips,Holic Brain,99% of Homeowners Would Call a Plumber If They Didn't Know This! Easy DIY Toilet Unclogging Tips,303108,424,24,2026-05-31,PT10M6S,https://youtube.com/watch?v=KVyWPqfdiKo,KVyWPqfdiKo
search: plumbing tips,Beamish DIY,Plumber Tricks That Fix Common Problems Fast 🔧💧 #diy #helpful #plumbing #tips,248829,233,2,2026-05-04,PT12M3S,https://youtube.com/watch?v=PtleLZwhZAE,PtleLZwhZAE
search: plumbing tips,Roger the Pipe Guy,Why Plumbers' Own Drains Never Clog — The $2 Monthly Habit They Don't Advertise,175268,5282,213,2026-06-20,PT18M45S,https://youtube.com/watch?v=YjPAVZAffh0,YjPAVZAffh0
search: plumbing tips,Roger the Pipe Guy,SharkBite vs Solder - Which Is ACTUALLY Stronger! (Pressure Test!),145171,3209,339,2026-04-17,PT18M20S,https://youtube.com/watch?v=DAZ4KZ6A5a0,DAZ4KZ6A5a0
search: plumbing tips,Tips Unknown,Amazing inventions of a 60-year-old plumber! Free energy source from old tires/PVC pipes.,74667,726,6,2026-05-16,PT16M11S,https://youtube.com/watch?v=gtrcJUVNJpw,gtrcJUVNJpw
search: plumbing tips,All About RV's,These 4 RV Sewer Valve Tips Changed Everything! RV Valve Maintenance Made Easy.,73052,3402,81,2026-05-23,PT11M24S,https://youtube.com/watch?v=jTUTSJd5SE0,jTUTSJd5SE0
search: plumbing tips,Roger the Pipe Guy,How to Plumb an ENTIRE Bathroom From SCRATCH - The ULTIMATE Rough-In Guide With FREE Diagrams!,54123,1197,14,2026-03-28,PT17M13S,https://youtube.com/watch?v=axJVjaq_9Sc,axJVjaq_9Sc
search: electrician tips,The DIY Guy,5 Electrical Hacks That Save Hundreds (DIY Friendly),642075,16296,1041,2026-04-25,PT17M35S,https://youtube.com/watch?v=vUq1nmhRSYE,vUq1nmhRSYE
search: electrician tips,Electric Online,Electrician Mastery: Learn These 2 Essential Concepts & Master All Electrical Work,99882,3998,169,2026-06-15,PT5M26S,https://youtube.com/watch?v=1jX5OkXJIeM,1jX5OkXJIeM
search: electrician tips,Solar and Electric tips,2 585 watt solar panel se kya kya chala sakte hain || how to install solar system step by step,80867,1541,296,2026-05-20,PT17M24S,https://youtube.com/watch?v=yGorfiPecPc,yGorfiPecPc
search: electrician tips,Electrical Telugu,On Grid Solar Panels కొన్ని నిజాలు || Electrical Telugu,72916,2079,118,2026-05-20,PT19M24S,https://youtube.com/watch?v=cNiMuRyukVI,cNiMuRyukVI
search: electrician tips,Electric Online,Make a Series Test Board with Just One Wire | Check All Faulty Electrical Appliances at Home,49478,1576,166,2026-06-01,PT4M50S,https://youtube.com/watch?v=0OvzpcSVYdI,0OvzpcSVYdI
search: electrician tips, ITI JOBS IG,कितने mm वायर कितना Load झेलता है? | 1mm से 6mm तक पूरा सच ⚡Wire Load Capacity ,44458,732,39,2026-04-12,PT5M35S,https://youtube.com/watch?v=kwQsyM_faAo,kwQsyM_faAo
search: electrician tips,Solar and Electric tips,Khurshid fan vs Tamoor Fan | Pakistan best AC DC fan ,31475,1400,446,2026-04-17,PT16M51S,https://youtube.com/watch?v=0_ETMPQCAk0,0_ETMPQCAk0
search: electrician tips,Solar and Electric tips,mora voltage protector setting || how to install voltage protector ,30544,756,102,2026-04-19,PT17M34S,https://youtube.com/watch?v=Q3Lps3foohY,Q3Lps3foohY
search: electrician tips,Carl Murawski,I Bought the Wrong Work Boots for 20 Years,25657,866,117,2026-06-19,PT10M22S,https://youtube.com/watch?v=-7V4qX9iPKI,-7V4qX9iPKI
search: electrician tips,Electric Online,Electrical Board Wiring Explained in 1 Minute | Identify Every Wire Easily | Beginner to Electrician,8508,559,58,2026-06-22,PT6M3S,https://youtube.com/watch?v=wc4Y-TQyCsQ,wc4Y-TQyCsQ
search: field service business,Oil Brick Road,Why Oilfield Trucking Trumps every other business,2332,76,15,2026-05-09,PT19M55S,https://youtube.com/watch?v=PFD5U47gJbQ,PFD5U47gJbQ
search: field service business,Rand Group,Dynamics 365 Field Service Overview,9481,9,0,2026-04-06,PT8M,https://youtube.com/watch?v=ygUKKAv-O5s,ygUKKAv-O5s
search: field service business,Odoo,Revamp Your Business: Odoo HVAC Configuration,1197,14,4,2026-04-08,PT4M33S,https://youtube.com/watch?v=pFSx7w-XmnE,pFSx7w-XmnE
search: field service business,Business Wali Smart Baate,"Full Video | Stop Managing Blindly, Start Tracking Your Field Operations Smartly",2914,14,4,2026-04-20,PT9M29S,https://youtube.com/watch?v=vKrS0uSTrAE,vKrS0uSTrAE
search: field service business,Maximizing Zoho for Your Business,Zoho CRM Deals Module for Field Service Businesses: 12 Years of Real-World Expertise,1651,2,4,2026-05-07,PT16M17S,https://youtube.com/watch?v=f627AvoEIG4,f627AvoEIG4
search: field service business,Business Solution,Contractor Plus Review & Demo: Best Field Service Software for Contractors?,971,5,15,2026-04-02,PT12M35S,https://youtube.com/watch?v=qIU6Hxkw5Is,qIU6Hxkw5Is
search: field service business,SAP Help and Learning,AI-Powered Asset and Service Operations with SAP Field Service and Asset Management | Demo,713,9,0,2026-05-20,PT6M35S,https://youtube.com/watch?v=SjxgS1F0yxs,SjxgS1F0yxs
search: field service business,OraclePy,Oracle Field Service (OFSC) Tutorial for Beginners | First Video,555,22,3,2026-04-09,PT12M32S,https://youtube.com/watch?v=cncVp4YzUMw,cncVp4YzUMw
search: field service business,Be Productive,Connecteam - Best Field Service Management Software for 2026,14387,10,28,2026-04-23,PT6M55S,https://youtube.com/watch?v=ZAZ9gR5ZkqI,ZAZ9gR5ZkqI
search: field service business,FieldPulse,FieldPulse Mobile App Overview (2026),503,7,0,2026-05-07,PT5M48S,https://youtube.com/watch?v=DqTsAdPAMIc,DqTsAdPAMIc
search: home service business,Sarthak Sachdeva,I Tried Secret Home Services!,1266848,24723,1810,2026-05-23,PT15M43S,https://youtube.com/watch?v=kLiwHHLzg9E,kLiwHHLzg9E
search: home service business,Patrick Dang,How I'd Start a 1-Person Business With Claude AI in 30 Days,418359,17075,380,2026-04-06,PT17M32S,https://youtube.com/watch?v=gRcBu8LyfGo,gRcBu8LyfGo
search: home service business,DIGITAL PATHSHALA,Small Business ideas at Home | Small Business Ideas 2026,274054,3081,87,2026-05-14,PT12M1S,https://youtube.com/watch?v=sYNr7uSEOuQ,sYNr7uSEOuQ
search: home service business,Alex Hormozi,How to Use AI in Your Business in 2026,225244,6149,225,2026-04-21,PT15M54S,https://youtube.com/watch?v=fr78adfAnuA,fr78adfAnuA
search: home service business,Austin Zaback,"10 ""Boring"" Service Businesses Making People Rich (Low Competition!)",188199,3622,133,2026-05-14,PT16M55S,https://youtube.com/watch?v=zZohb9W-TiA,zZohb9W-TiA
search: home service business,Austin Zaback,"9 Service Businesses You Can Start Under $1,000 (No Experience Needed)",175732,3261,122,2026-04-09,PT18M59S,https://youtube.com/watch?v=xFn0gw_gocw,xFn0gw_gocw
search: home service business,Tim Richard,9 Low-Competition Service Businesses No One Is Talking About,168047,4154,124,2026-04-07,PT15M20S,https://youtube.com/watch?v=breAeo8UKpU,breAeo8UKpU
search: home service business,Idea To Revenue,₹0 முதலீட்டில் ஒரு அருமையான Business! | Start Your AI Business From Home,62786,1549,253,2026-06-14,PT11M55S,https://youtube.com/watch?v=5XroYjWLwWk,5XroYjWLwWk
search: home service business,MoreMozi,How to Get More Leads in a Local Service Business,21399,344,14,2026-05-19,PT7M10S,https://youtube.com/watch?v=HaCf4VlnDLw,HaCf4VlnDLw
search: home service business,Steve Hunsaker | Home Service Accelerator,How to Generate So Many Home Service Business Leads it Feels ILLEGAL,17209,715,29,2026-04-06,PT12M30S,https://youtube.com/watch?v=mQoYVIyK3LU,mQoYVIyK3LU
